1,Tampflex,consequat metus sapien ut nunc vestibulum ante ipsum primis in faucibus orci luctus et ultrices posuere cubilia curae mauris viverra diam vitae quam suspendisse potenti nullam porttitor lacus at turpis,.img/beer_default.jpg,7
2,Daltfresh,leo odio condimentum id luctus nec molestie sed justo pellentesque viverra pede ac diam cras pellentesque volutpat dui maecenas tristique est et tempus semper est quam pharetra magna ac consequat metus sapien ut nunc vestibulum ante ipsum primis in,.img/beer_default.jpg,4
3,Tresom,felis donec semper sapien a libero nam dui proin leo odio porttitor id consequat in consequat ut nulla sed accumsan felis ut at dolor quis odio consequat varius integer ac leo pellentesque ultrices mattis odio donec vitae nisi nam ultrices libero non mattis,.img/beer_default.jpg,9
4,Toughjoyfax,risus auctor sed tristique in tempus sit amet sem fusce consequat nulla nisl nunc,.img/beer_default.jpg,9
5,Aerified,justo aliquam quis turpis eget elit sodales scelerisque mauris sit amet eros suspendisse accumsan tortor quis turpis sed ante vivamus tortor duis mattis egestas metus aenean fermentum donec ut mauris eget massa tempor,.img/beer_default.jpg,3
6,Latlux,integer a nibh in quis justo maecenas rhoncus aliquam lacus morbi quis tortor id nulla ultrices aliquet maecenas leo odio condimentum id luctus nec molestie sed justo pellentesque viverra pede ac diam cras pellentesque volutpat dui maecenas tristique,.img/beer_default.jpg,9
7,Zoolab,sit amet turpis elementum ligula vehicula consequat morbi a ipsum integer a nibh in quis justo,.img/beer_default.jpg,9
8,Home Ing,lacinia eget tincidunt eget tempus vel pede morbi porttitor lorem id ligula suspendisse ornare consequat lectus in est risus auctor sed tristique in tempus sit amet sem fusce consequat,.img/beer_default.jpg,8
9,Domainer,diam erat fermentum justo nec condimentum neque sapien placerat ante nulla justo aliquam quis turpis eget elit sodales scelerisque mauris sit amet eros suspendisse accumsan tortor quis turpis sed ante vivamus tortor duis mattis egestas metus aenean fermentum donec ut mauris eget massa tempor convallis,.img/beer_default.jpg,6
10,Quo Lux,nullam orci pede venenatis non sodales sed tincidunt eu felis fusce posuere,.img/beer_default.jpg,7
11,Zoolab,erat vestibulum sed magna at nunc commodo placerat praesent blandit nam nulla integer pede justo lacinia eget tincidunt eget tempus vel pede,.img/beer_default.jpg,3
12,Treeflex,quis augue luctus tincidunt nulla mollis molestie lorem quisque ut erat curabitur gravida nisi at nibh in hac habitasse platea dictumst aliquam augue quam sollicitudin vitae consectetuer eget rutrum at lorem integer tincidunt ante vel ipsum praesent blandit lacinia erat vestibulum,.img/beer_default.jpg,6
13,Sonsing,libero ut massa volutpat convallis morbi odio odio elementum eu interdum eu tincidunt in leo maecenas pulvinar lobortis est phasellus sit amet erat nulla tempus vivamus in felis eu sapien cursus vestibulum proin eu mi nulla ac enim in tempor turpis nec euismod scelerisque quam turpis adipiscing,.img/beer_default.jpg,10
14,Pannier,ipsum praesent blandit lacinia erat vestibulum sed magna at nunc commodo placerat praesent blandit nam nulla integer pede justo lacinia,.img/beer_default.jpg,10
15,Lotlux,elit sodales scelerisque mauris sit amet eros suspendisse accumsan tortor quis turpis sed ante vivamus tortor duis mattis egestas,.img/beer_default.jpg,7
16,Sub-Ex,posuere cubilia curae duis faucibus accumsan odio curabitur convallis duis consequat dui nec nisi volutpat eleifend donec ut dolor morbi vel lectus in quam fringilla rhoncus mauris enim leo rhoncus sed vestibulum sit amet cursus id turpis integer aliquet massa id lobortis convallis tortor risus,.img/beer_default.jpg,8
17,Voltsillam,tristique est et tempus semper est quam pharetra magna ac consequat metus sapien ut nunc vestibulum ante ipsum primis in faucibus orci luctus et ultrices posuere cubilia curae mauris viverra diam vitae quam,.img/beer_default.jpg,2
18,Matsoft,enim in tempor turpis nec euismod scelerisque quam turpis adipiscing lorem vitae mattis nibh ligula nec sem duis aliquam convallis nunc proin at turpis a pede posuere nonummy integer non velit,.img/beer_default.jpg,4
19,Subin,adipiscing lorem vitae mattis nibh ligula nec sem duis aliquam convallis nunc proin at turpis a pede posuere nonummy integer non velit donec diam neque vestibulum eget vulputate ut ultrices vel augue vestibulum,.img/beer_default.jpg,10
20,Y-Solowarm,leo rhoncus sed vestibulum sit amet cursus id turpis integer aliquet massa,.img/beer_default.jpg,4
21,Voyatouch,id nulla ultrices aliquet maecenas leo odio condimentum id luctus nec molestie sed justo pellentesque viverra pede ac diam cras pellentesque volutpat dui maecenas tristique est et tempus semper est quam pharetra magna ac,.img/beer_default.jpg,3
22,Subin,convallis morbi odio odio elementum eu interdum eu tincidunt in leo maecenas pulvinar lobortis est phasellus sit amet erat nulla tempus vivamus in felis eu sapien cursus vestibulum proin eu mi nulla ac enim in tempor turpis nec euismod scelerisque,.img/beer_default.jpg,9
23,Voltsillam,primis in faucibus orci luctus et ultrices posuere cubilia curae nulla dapibus dolor vel est donec odio justo sollicitudin ut suscipit a feugiat et eros vestibulum ac est lacinia nisi venenatis tristique fusce congue diam id ornare imperdiet,.img/beer_default.jpg,3
24,Zamit,eu interdum eu tincidunt in leo maecenas pulvinar lobortis est phasellus sit amet erat nulla tempus vivamus in felis eu sapien cursus vestibulum proin eu mi nulla ac enim in tempor,.img/beer_default.jpg,5
25,Span,dolor sit amet consectetuer adipiscing elit proin interdum mauris non ligula pellentesque ultrices phasellus id sapien in sapien iaculis congue vivamus metus arcu adipiscing molestie hendrerit at vulputate vitae nisl aenean lectus pellentesque eget nunc donec quis,.img/beer_default.jpg,10
26,Bigtax,sit amet consectetuer adipiscing elit proin interdum mauris non ligula,.img/beer_default.jpg,3
27,Aerified,nulla justo aliquam quis turpis eget elit sodales scelerisque mauris sit amet eros suspendisse accumsan tortor quis turpis sed ante vivamus tortor duis mattis egestas metus aenean fermentum donec ut mauris eget massa tempor convallis nulla neque libero convallis eget eleifend,.img/beer_default.jpg,4
28,Duobam,et tempus semper est quam pharetra magna ac consequat metus sapien ut nunc vestibulum ante ipsum primis in faucibus orci luctus et ultrices posuere cubilia curae mauris viverra diam vitae quam suspendisse potenti nullam porttitor lacus at turpis donec posuere metus vitae ipsum aliquam non mauris morbi non,.img/beer_default.jpg,4
29,Pannier,mi sit amet lobortis sapien sapien non mi integer ac neque duis bibendum morbi non quam nec dui luctus rutrum nulla tellus in sagittis dui vel nisl duis ac nibh fusce lacus purus aliquet at feugiat non pretium quis lectus suspendisse potenti in eleifend quam a odio,.img/beer_default.jpg,1
30,Daltfresh,feugiat et eros vestibulum ac est lacinia nisi venenatis tristique fusce congue diam id ornare imperdiet sapien urna pretium nisl ut volutpat sapien arcu sed augue aliquam erat volutpat in congue etiam justo etiam pretium iaculis justo in hac habitasse platea dictumst,.img/beer_default.jpg,10
31,Tres-Zap,ut at dolor quis odio consequat varius integer ac leo pellentesque ultrices mattis odio donec vitae nisi nam ultrices libero non mattis pulvinar,.img/beer_default.jpg,6
32,Span,in hac habitasse platea dictumst maecenas ut massa quis augue luctus tincidunt nulla mollis molestie lorem quisque ut erat curabitur gravida nisi at nibh in hac habitasse platea dictumst aliquam augue quam sollicitudin vitae consectetuer eget rutrum at lorem integer tincidunt ante vel ipsum,.img/beer_default.jpg,9
33,Home Ing,turpis a pede posuere nonummy integer non velit donec diam neque vestibulum eget vulputate ut ultrices vel augue vestibulum ante ipsum primis in,.img/beer_default.jpg,4
34,Rank,lobortis ligula sit amet eleifend pede libero quis orci nullam molestie nibh in lectus pellentesque at nulla suspendisse potenti cras in purus eu magna vulputate luctus,.img/beer_default.jpg,4
35,Sonsing,varius nulla facilisi cras non velit nec nisi vulputate nonummy maecenas tincidunt lacus at velit vivamus vel nulla eget eros elementum pellentesque quisque porta volutpat erat quisque erat eros viverra eget congue eget semper rutrum nulla nunc purus phasellus in felis donec semper,.img/beer_default.jpg,5
36,Wrapsafe,lacinia aenean sit amet justo morbi ut odio cras mi pede malesuada in imperdiet et commodo vulputate justo in blandit ultrices enim lorem ipsum dolor sit amet consectetuer adipiscing elit proin interdum mauris non,.img/beer_default.jpg,8
37,Holdlamis,mi integer ac neque duis bibendum morbi non quam nec dui luctus rutrum nulla tellus,.img/beer_default.jpg,9
38,Zaam-Dox,accumsan tellus nisi eu orci mauris lacinia sapien quis libero nullam sit amet turpis elementum ligula vehicula consequat morbi a,.img/beer_default.jpg,5
39,Cardify,ligula vehicula consequat morbi a ipsum integer a nibh in quis justo maecenas rhoncus aliquam lacus morbi quis tortor id nulla ultrices aliquet maecenas leo odio condimentum,.img/beer_default.jpg,5
40,Overhold,ornare imperdiet sapien urna pretium nisl ut volutpat sapien arcu sed augue aliquam erat volutpat in congue etiam justo etiam pretium iaculis justo in hac habitasse platea dictumst etiam faucibus cursus urna ut tellus,.img/beer_default.jpg,2
41,Fixflex,sapien in sapien iaculis congue vivamus metus arcu adipiscing molestie hendrerit at vulputate vitae nisl aenean,.img/beer_default.jpg,7
42,Matsoft,eu sapien cursus vestibulum proin eu mi nulla ac enim in tempor turpis nec euismod scelerisque quam turpis adipiscing lorem vitae mattis nibh ligula nec sem duis aliquam convallis nunc proin at turpis a pede posuere nonummy integer non velit donec diam neque vestibulum,.img/beer_default.jpg,9
43,Tin,quisque erat eros viverra eget congue eget semper rutrum nulla nunc,.img/beer_default.jpg,3
44,Redhold,est donec odio justo sollicitudin ut suscipit a feugiat et eros vestibulum ac est lacinia nisi venenatis tristique fusce congue diam id ornare imperdiet sapien urna pretium nisl ut volutpat sapien arcu sed augue aliquam erat volutpat in congue etiam justo etiam pretium iaculis,.img/beer_default.jpg,4
45,Daltfresh,varius ut blandit non interdum in ante vestibulum ante ipsum primis in faucibus orci luctus et ultrices posuere cubilia curae duis faucibus accumsan odio curabitur convallis duis consequat dui nec nisi volutpat eleifend donec ut dolor morbi vel lectus,.img/beer_default.jpg,7
46,Solarbreeze,vehicula condimentum curabitur in libero ut massa volutpat convallis morbi odio odio elementum eu interdum eu tincidunt in leo maecenas pulvinar lobortis est phasellus sit amet erat nulla tempus vivamus in felis eu sapien cursus vestibulum,.img/beer_default.jpg,1
47,Matsoft,nulla nisl nunc nisl duis bibendum felis sed interdum venenatis turpis enim blandit mi in porttitor pede justo eu massa donec dapibus duis at velit eu est congue elementum in,.img/beer_default.jpg,3
48,Solarbreeze,mauris sit amet eros suspendisse accumsan tortor quis turpis sed ante vivamus tortor duis mattis egestas metus aenean fermentum donec ut mauris eget massa tempor convallis nulla neque libero convallis eget eleifend luctus ultricies eu nibh quisque id justo sit amet,.img/beer_default.jpg,5
49,Wrapsafe,justo nec condimentum neque sapien placerat ante nulla justo aliquam quis turpis eget elit sodales scelerisque mauris sit amet eros suspendisse accumsan tortor quis,.img/beer_default.jpg,2
50,Fixflex,donec odio justo sollicitudin ut suscipit a feugiat et eros vestibulum ac est lacinia nisi venenatis tristique fusce congue diam id ornare imperdiet sapien urna pretium nisl ut volutpat sapien arcu sed augue,.img/beer_default.jpg,4
51,Andalax,massa donec dapibus duis at velit eu est congue elementum in hac habitasse platea dictumst,.img/beer_default.jpg,1
52,Treeflex,diam vitae quam suspendisse potenti nullam porttitor lacus at turpis donec posuere metus vitae ipsum aliquam,.img/beer_default.jpg,6
53,Zamit,nonummy integer non velit donec diam neque vestibulum eget vulputate ut ultrices vel augue vestibulum ante ipsum primis in faucibus orci luctus et ultrices posuere cubilia curae donec pharetra magna vestibulum aliquet ultrices erat tortor sollicitudin mi sit amet lobortis,.img/beer_default.jpg,1
54,Latlux,morbi vestibulum velit id pretium iaculis diam erat fermentum justo nec condimentum neque sapien placerat ante nulla justo aliquam,.img/beer_default.jpg,2
55,Duobam,augue quam sollicitudin vitae consectetuer eget rutrum at lorem integer tincidunt ante vel ipsum praesent blandit lacinia erat vestibulum sed magna,.img/beer_default.jpg,2
56,Stringtough,orci luctus et ultrices posuere cubilia curae donec pharetra magna vestibulum aliquet ultrices erat tortor sollicitudin mi sit amet lobortis sapien sapien non mi integer ac neque duis bibendum morbi non quam nec dui luctus rutrum nulla tellus in sagittis dui vel,.img/beer_default.jpg,9
57,Bytecard,sapien sapien non mi integer ac neque duis bibendum morbi non quam nec dui luctus rutrum nulla tellus in sagittis dui vel nisl duis ac nibh fusce lacus purus aliquet at feugiat non pretium quis lectus suspendisse potenti in eleifend quam a odio in hac,.img/beer_default.jpg,4
58,Flexidy,fermentum donec ut mauris eget massa tempor convallis nulla neque libero convallis eget eleifend luctus ultricies eu nibh quisque id justo sit amet sapien dignissim vestibulum vestibulum ante ipsum primis in faucibus orci luctus et ultrices posuere cubilia curae nulla dapibus dolor vel est donec,.img/beer_default.jpg,10
59,Sonsing,lectus vestibulum quam sapien varius ut blandit non interdum in ante vestibulum ante ipsum primis in faucibus orci luctus et ultrices posuere cubilia curae duis faucibus accumsan odio curabitur convallis duis consequat dui nec,.img/beer_default.jpg,1
60,Quo Lux,congue risus semper porta volutpat quam pede lobortis ligula sit amet eleifend pede libero quis orci nullam molestie nibh in lectus pellentesque at nulla suspendisse,.img/beer_default.jpg,6
61,Ventosanzap,proin risus praesent lectus vestibulum quam sapien varius ut blandit non interdum in ante vestibulum ante ipsum primis in faucibus orci luctus et ultrices posuere cubilia curae duis faucibus accumsan odio curabitur convallis duis consequat,.img/beer_default.jpg,2
62,Biodex,cubilia curae donec pharetra magna vestibulum aliquet ultrices erat tortor sollicitudin mi sit amet lobortis sapien sapien non mi integer ac neque duis bibendum morbi non quam nec dui luctus rutrum nulla tellus in sagittis dui vel nisl duis ac,.img/beer_default.jpg,10
63,Konklab,consequat metus sapien ut nunc vestibulum ante ipsum primis in faucibus orci luctus et ultrices posuere cubilia curae mauris viverra,.img/beer_default.jpg,3
64,Sonsing,mauris sit amet eros suspendisse accumsan tortor quis turpis sed ante vivamus,.img/beer_default.jpg,3
65,Subin,commodo placerat praesent blandit nam nulla integer pede justo lacinia eget tincidunt eget tempus vel pede morbi porttitor lorem id ligula suspendisse ornare consequat lectus in,.img/beer_default.jpg,5
66,Solarbreeze,laoreet ut rhoncus aliquet pulvinar sed nisl nunc rhoncus dui vel sem sed sagittis nam congue risus semper porta volutpat quam pede lobortis ligula sit amet eleifend pede libero quis orci nullam molestie nibh in lectus pellentesque,.img/beer_default.jpg,9
67,Home Ing,non pretium quis lectus suspendisse potenti in eleifend quam a odio in hac habitasse platea dictumst maecenas ut massa quis augue luctus tincidunt nulla mollis molestie lorem quisque ut erat curabitur gravida nisi at nibh,.img/beer_default.jpg,8
68,Bamity,nulla sed accumsan felis ut at dolor quis odio consequat varius integer ac leo pellentesque ultrices mattis odio donec vitae nisi nam ultrices libero non mattis pulvinar nulla pede ullamcorper augue a suscipit nulla elit ac nulla sed vel enim,.img/beer_default.jpg,4
69,Tempsoft,vitae nisl aenean lectus pellentesque eget nunc donec quis orci eget orci vehicula condimentum curabitur in libero ut massa volutpat convallis morbi odio odio elementum eu interdum eu tincidunt in leo maecenas pulvinar lobortis est phasellus sit amet erat,.img/beer_default.jpg,4
70,Fintone,phasellus sit amet erat nulla tempus vivamus in felis eu sapien cursus,.img/beer_default.jpg,4
71,Cardify,nullam varius nulla facilisi cras non velit nec nisi vulputate nonummy maecenas tincidunt lacus at velit vivamus vel nulla,.img/beer_default.jpg,10
72,Voyatouch,id justo sit amet sapien dignissim vestibulum vestibulum ante ipsum primis in faucibus orci luctus et ultrices posuere cubilia curae nulla dapibus dolor,.img/beer_default.jpg,2
73,Cookley,nec euismod scelerisque quam turpis adipiscing lorem vitae mattis nibh ligula nec sem duis aliquam convallis nunc proin at turpis a pede posuere nonummy integer non velit donec diam,.img/beer_default.jpg,10
74,Fintone,dictumst morbi vestibulum velit id pretium iaculis diam erat fermentum justo nec condimentum neque sapien placerat ante nulla justo aliquam quis turpis eget elit sodales scelerisque mauris sit amet eros suspendisse accumsan tortor quis turpis sed ante vivamus tortor duis mattis egestas metus aenean fermentum donec ut mauris,.img/beer_default.jpg,7
75,Aerified,sit amet cursus id turpis integer aliquet massa id lobortis convallis tortor risus dapibus augue vel accumsan tellus nisi eu orci mauris lacinia sapien,.img/beer_default.jpg,9
76,Rank,dolor quis odio consequat varius integer ac leo pellentesque ultrices mattis odio donec vitae nisi nam ultrices libero non mattis pulvinar nulla pede ullamcorper augue a suscipit nulla elit ac nulla sed,.img/beer_default.jpg,9
77,Lotlux,faucibus cursus urna ut tellus nulla ut erat id mauris vulputate elementum nullam varius nulla facilisi cras,.img/beer_default.jpg,7
78,Andalax,consequat lectus in est risus auctor sed tristique in tempus sit amet sem fusce consequat nulla nisl nunc nisl duis bibendum felis sed interdum venenatis turpis enim blandit mi in porttitor pede,.img/beer_default.jpg,4
79,Bamity,morbi vel lectus in quam fringilla rhoncus mauris enim leo rhoncus sed vestibulum sit amet cursus id turpis integer aliquet massa id lobortis convallis tortor risus dapibus augue vel accumsan tellus nisi eu orci mauris lacinia sapien quis libero nullam sit amet turpis elementum ligula vehicula consequat,.img/beer_default.jpg,9
80,Cookley,magna vulputate luctus cum sociis natoque penatibus et magnis dis parturient montes nascetur ridiculus mus vivamus vestibulum sagittis sapien cum sociis,.img/beer_default.jpg,1
81,Greenlam,convallis duis consequat dui nec nisi volutpat eleifend donec ut,.img/beer_default.jpg,3
82,Hatity,volutpat quam pede lobortis ligula sit amet eleifend pede libero quis orci nullam molestie nibh in lectus pellentesque at nulla suspendisse potenti cras in purus eu magna vulputate luctus cum sociis natoque penatibus et magnis dis parturient montes nascetur ridiculus mus vivamus vestibulum sagittis sapien cum sociis,.img/beer_default.jpg,2
83,Flexidy,in tempus sit amet sem fusce consequat nulla nisl nunc nisl duis bibendum felis sed interdum venenatis turpis enim blandit mi in porttitor pede justo eu massa donec dapibus duis at,.img/beer_default.jpg,2
84,Zaam-Dox,vel nisl duis ac nibh fusce lacus purus aliquet at feugiat non pretium quis lectus suspendisse potenti in eleifend quam a,.img/beer_default.jpg,5
85,Voltsillam,in imperdiet et commodo vulputate justo in blandit ultrices enim lorem ipsum dolor,.img/beer_default.jpg,7
86,Asoka,vestibulum sagittis sapien cum sociis natoque penatibus et magnis dis parturient montes nascetur ridiculus mus etiam vel augue vestibulum rutrum rutrum neque aenean auctor gravida sem praesent id massa id nisl venenatis lacinia aenean,.img/beer_default.jpg,3
87,Ronstring,sit amet consectetuer adipiscing elit proin interdum mauris non ligula pellentesque ultrices phasellus id sapien in sapien iaculis congue vivamus metus arcu adipiscing molestie hendrerit at vulputate vitae nisl aenean lectus pellentesque eget nunc donec,.img/beer_default.jpg,6
88,Job,lacus morbi sem mauris laoreet ut rhoncus aliquet pulvinar sed nisl nunc rhoncus dui vel sem,.img/beer_default.jpg,8
89,Fix San,volutpat sapien arcu sed augue aliquam erat volutpat in congue etiam justo etiam pretium iaculis justo in hac habitasse platea dictumst etiam faucibus cursus urna ut tellus nulla ut erat id mauris vulputate elementum nullam varius nulla facilisi cras non velit nec nisi vulputate nonummy maecenas tincidunt lacus at,.img/beer_default.jpg,1
90,Bytecard,nulla nunc purus phasellus in felis donec semper sapien a libero nam,.img/beer_default.jpg,4
91,Tin,eros suspendisse accumsan tortor quis turpis sed ante vivamus tortor duis mattis egestas metus aenean,.img/beer_default.jpg,7
92,Wrapsafe,sit amet eros suspendisse accumsan tortor quis turpis sed ante vivamus tortor duis mattis egestas metus aenean fermentum donec ut mauris eget massa tempor convallis nulla neque libero convallis eget eleifend luctus ultricies eu nibh quisque id justo sit amet sapien,.img/beer_default.jpg,9
93,Voltsillam,convallis tortor risus dapibus augue vel accumsan tellus nisi eu orci mauris lacinia sapien quis libero nullam sit amet turpis elementum ligula vehicula consequat morbi a ipsum integer a,.img/beer_default.jpg,7
94,Tresom,vestibulum sagittis sapien cum sociis natoque penatibus et magnis dis parturient montes nascetur ridiculus mus etiam vel augue vestibulum rutrum rutrum,.img/beer_default.jpg,6
95,Treeflex,sed nisl nunc rhoncus dui vel sem sed sagittis nam congue risus semper porta volutpat quam pede lobortis ligula sit amet eleifend pede libero quis orci nullam molestie nibh in lectus pellentesque at nulla suspendisse,.img/beer_default.jpg,8
96,Namfix,in hac habitasse platea dictumst etiam faucibus cursus urna ut tellus nulla ut erat id mauris vulputate elementum nullam varius nulla facilisi cras non velit nec nisi vulputate nonummy maecenas tincidunt lacus at velit,.img/beer_default.jpg,8
97,Aerified,in hac habitasse platea dictumst etiam faucibus cursus urna ut tellus nulla ut erat id mauris vulputate elementum nullam varius nulla facilisi cras non velit nec nisi vulputate nonummy maecenas tincidunt lacus at velit vivamus vel nulla eget eros elementum pellentesque quisque porta volutpat erat quisque erat,.img/beer_default.jpg,5
98,Duobam,metus vitae ipsum aliquam non mauris morbi non lectus aliquam sit amet diam in magna bibendum,.img/beer_default.jpg,10
99,Ronstring,semper sapien a libero nam dui proin leo odio porttitor id consequat in,.img/beer_default.jpg,4
100,Bamity,diam id ornare imperdiet sapien urna pretium nisl ut volutpat sapien arcu sed,.img/beer_default.jpg,9
